{
  "adapter": {
    "mode": "folder",
    "name": "folder"
  },
  "checks_run": [
    "check_required_files",
    "check_empty_files",
    "check_missing_sensor_files",
    "check_broken_paths",
    "check_duplicate_filenames",
    "check_metadata_schema",
    "check_declared_sensors_exist",
    "check_duration_matches_timestamps",
    "check_dataset_version_present",
    "check_monotonic_timestamps",
    "check_duplicate_timestamps",
    "check_large_timestamp_gaps",
    "check_sensor_columns",
    "check_sensor_dimensions",
    "check_sensor_frequency",
    "check_missing_frames",
    "check_sensor_time_overlap",
    "check_timestamp_offset",
    "check_pairwise_sync_gap",
    "check_frequency_stability",
    "check_calibration_exists",
    "check_intrinsics_shape",
    "check_intrinsics_values",
    "check_extrinsics_shape",
    "check_quaternion_norm",
    "check_label_columns",
    "check_label_confidence_range",
    "check_label_geometry",
    "check_label_timestamps_match_sensor_range",
    "check_track_id_consistency",
    "check_label_bbox_jumps",
    "check_label_missing_timestamps",
    "check_duplicate_track_id_timestamp",
    "check_short_tracks",
    "check_label_size_changes",
    "check_trajectory_columns",
    "check_trajectory_finite_values",
    "check_unrealistic_speed",
    "check_unrealistic_acceleration",
    "check_yaw_range",
    "check_stationary_dataset"
  ],
  "config": {
    "duration_drop_ratio_warning": 0.1,
    "duration_tolerance_sec": 1.0,
    "expected_sensor_rates": {
      "camera_front": 10.0,
      "camera_rear": 10.0,
      "gps": 10.0,
      "imu": 100.0
    },
    "frame_count_drop_ratio_warning": 0.1,
    "frequency_jitter_ratio": 0.2,
    "frequency_tolerance_fraction": 0.3,
    "issue_regression_severity": "warning",
    "label_class_switch_threshold": 0,
    "label_max_position_jump_px": 200.0,
    "label_max_size_change_ratio": 3.0,
    "label_min_track_length": 3,
    "max_accel_mps2": 12.0,
    "max_pairwise_sync_gap_sec": 0.05,
    "max_speed_mps": 70.0,
    "min_overlap_ratio": 0.8,
    "missing_frame_gap_multiplier": 1.5,
    "stationary_distance_threshold_m": 0.05,
    "timestamp_gap_threshold_sec": 0.5
  },
  "dataset_fingerprint": "sha256:3b830851a5d1795f6b09a42622e34eed5e8f814560f60da83c5c1620dbdc52ce",
  "dataset_path": "examples/minimal_dataset",
  "dataset_summary": {
    "available_modalities": [
      "sensors",
      "labels",
      "trajectories",
      "calibration",
      "metadata"
    ],
    "declared_sensors": [
      "camera_front",
      "imu",
      "gps"
    ],
    "label_file_count": 1,
    "label_row_counts": {
      "detections": 3
    },
    "sensor_count": 3,
    "sensor_frame_counts": {
      "camera_front": 3,
      "gps": 3,
      "imu": 21
    },
    "trajectory_file_count": 1,
    "trajectory_row_counts": {
      "ego": 3
    }
  },
  "datasetlint_version": "0.1.0",
  "findings": [],
  "generated_at": "2026-06-29T14:09:59+00:00",
  "issues": [],
  "passed": true,
  "stats": {
    "declared_sensor_count": 3,
    "issue_count": 0,
    "issue_count_by_severity": {
      "error": 0,
      "info": 0,
      "warning": 0
    },
    "label_file_count": 1,
    "sensor_count": 3,
    "sync": {
      "overlap_duration_sec": 0.2,
      "pairwise_gaps": {
        "camera_front:gps": {
          "max_gap_sec": 0.0,
          "median_gap_sec": 0.0
        },
        "camera_front:imu": {
          "max_gap_sec": 0.0,
          "median_gap_sec": 0.0
        },
        "gps:imu": {
          "max_gap_sec": 0.0,
          "median_gap_sec": 0.0
        }
      },
      "sensors": {
        "camera_front": {
          "duration_sec": 0.2,
          "end_time": 0.2,
          "frame_count": 3.0,
          "inferred_frequency_hz": 10.0,
          "max_dt_sec": 0.1,
          "median_dt_sec": 0.1,
          "start_time": 0.0
        },
        "gps": {
          "duration_sec": 0.2,
          "end_time": 0.2,
          "frame_count": 3.0,
          "inferred_frequency_hz": 10.0,
          "max_dt_sec": 0.1,
          "median_dt_sec": 0.1,
          "start_time": 0.0
        },
        "imu": {
          "duration_sec": 0.2,
          "end_time": 0.2,
          "frame_count": 21.0,
          "inferred_frequency_hz": 99.99999999999999,
          "max_dt_sec": 0.010000000000000009,
          "median_dt_sec": 0.010000000000000002,
          "start_time": 0.0
        }
      }
    },
    "trajectory_file_count": 1
  }
}
